Search term,Ignore (y/N),Comments
"We have spent our entire lives in the business of clothing, from economy lines to luxury lines,.Thousands of products in different styles are waiting for you!After spending 15 years learning this market and business we decided to put all of our contacts in manufacturing and designing to good use. Our mission is to bring the newest and best designs in clothing to you.",,
"committed to the progress of sustainability within our business practices. With consistent evaluation and attention, we are proud to have brought on changes that have an emphasis on renewable energy, recycling, and beyond.",,
"and since then we have managed countless of online stores. Our mission is supplying you with the latest, most interesting and useful items whilst providing and excellent customer experience. We believe that e-commerce is today's way of shopping and that it will grow more and more in the future. It provides us with many conveniences - we don't have to go further than our bed in order to do our shopping. We can instantly check the reviews of a particular product from people who already purchased. We take those features and try to take them to the next level so you can get the best possible experience.",,Low count
is your global online store that delivers latest fashion apparel for you! Thousands of products in different styles are waiting for you!,,
"for one simple reason: We strive to improve the lives of those on-the-go by creating durable, functional and adaptable products at a great value; and we do this by co-creating products with you.",,Low count
"Since we know you want all sorts of custom products, we got you covered with highly professional suppliers and production houses that we keep in close contact with and vet daily so that they fulfill",,
"No matter where you are, who you are and what you are passionate about we want to be able to provide you with high value products that help you Express Yourself...to help you express who you really are!",,
"We have spent years searching for creative, smart, and useful products around the world and bring them to you with a belief that they may help you make your life easier. We are also helping a lot of people have great ideas to gift their friends. We are sure that in this online shopping house, there is stuff you may not know that has even existed.",,
CLEARANCE WAREHOUSE BRINGS YOU FACTORY DIRECT PRODUCTS AT WHOLESALE PRICE Welcome to a new era of buying online. Clearance Warehouse brings you factory direct products at wholesale price. Guaranteed. We are US premier wholesale clearance centre. Want to experience a whole new way of buying products online for your home or office? How does up to 80% off normal pricing sound?,,Low count
"We take pride in our customer service. We have an entire team based in our corporate office in Montgomery, Alabama, that is dedicated to our customers and customers’ experiences! You can contact us through email, online chat or by phone.",,Low count
Our love for USA-Made products is evident as you scroll throughout our website. Each month we research to obtain new brands which are made in the USA. We are proud to carry many great brands and have a quality of service that is hard to find these days.,,Low count
We source designer style products. And have been able to do this by building great long term relationships with several manufacturers over the years. This allows us to produce unique pieces at the lowest possible cost and sell directly to you.,,Low count
"We work around the clock to find the most innovative products, this way you don't have to spend hours doing your own research. With a mission to provide the best products with the best quality and the best of service to our customer. Our goal is to position wholesalestore as the online service leader. Trust our team of experts to help you stay ahead of the curve, and always be on the cutting edge of technology. Join our product revolution as we continuously challenge what is possible in your life and help bring awesomeness worldwide.",,Low count
"store, the best place to discover an unparalleled and unique selection of art by suits all budgets, styles, and spaces. Our vast collection of art products including but not limited to mugs, blankets,  bracelets, posters & canvas, and much more, makes it easy for you to find something for everyone you love—including you.",,Low count
Our business was started by a small team of very ambitious young men and women. We've worked in the retail industry for several years. This eventually prompted us to start our own little venture and we opened a local store to sell our products.,,Low count
"If you ever have problems with your order, we'll do everything we can to make it right. We aim to treat you like family. We know we're in business because of you. Bring the highest quality products with the lowest prices to customers.",,
"As a result, we have an industry leading low claims ratio and long-term relationships with our satisfied customers across wide ranging industries. Again, the higher the value of the goods that customers tender to us, the better fit it is for our organization.",,Low count
"is the premier multi-game trading site allowing users to trade their virtual items between different games. The main goal is to make skin trading accessible and possible for everyone. We try to accomplish our goal by offering 24/7 support, a smooth site interaction and a lot of functionalities for our users to enjoy.",,Low count
"Serving customers is our specialty - our devoted team is live and available to assist. We guarantee prompt and efficient service, all day, every day - no mess, no fuss!",,Low count
"Your satisfaction is our service purpose, if you have any question or need help, please feel free to contact with us, we will help you.",,
"started up with a clear international mission and with the intention of dressing young people who are engaged with their environment, who live in the community and relate to each other. Young people who have a casual dress sense, who shun stereotypes and who want to feel good in whatever they are wearing.",,Low count
"First, select your favorite products, their sizes and quantities, then add them to your shopping cart, after filling out the shipping address information, finally, choose the payment method to complete the payment.",,Low count
"provides you with fantastic products at unbeatable prices! We invite you to browse our store and buy ligne.Si you have questions, please contact",,Low count
We’ve combined a new kind of doctor’s experience that blends the highest level of health care with exceptional service. People can enroll in membership by paying only an annual membership fee of just $129.,,
Various Styles: More than 4000 different models in stock to catch the market demand and we will update our inventory in time.,,
